{
  "schema": "mikai.native.bundle/1",
  "kind": "native",
  "version": "0.41.0-native.1",
  "module": "libmpv-2.dll",
  "mpvApiVersion": 131077,
  "protocolVersion": 1,
  "engineSchemaVersion": 1,
  "deps": [
    "trt",
    "ort"
  ],
  "files": [
    {
      "path": "libmpv-2.dll",
      "bytes": 0,
      "sha256": "0000000000000000000000000000000000000000000000000000000000000000"
    },
    {
      "path": "aji.dll",
      "bytes": 0,
      "sha256": "0000000000000000000000000000000000000000000000000000000000000000"
    },
    {
      "path": "aji_trt.dll",
      "bytes": 0,
      "sha256": "0000000000000000000000000000000000000000000000000000000000000000"
    },
    {
      "path": "aji_dml.dll",
      "bytes": 0,
      "sha256": "0000000000000000000000000000000000000000000000000000000000000000"
    },
    {
      "path": "trt/nvinfer_11.dll",
      "bytes": 0,
      "sha256": "0000000000000000000000000000000000000000000000000000000000000000"
    },
    {
      "path": "trt/nvinfer_plugin_11.dll",
      "bytes": 0,
      "sha256": "0000000000000000000000000000000000000000000000000000000000000000"
    },
    {
      "path": "trt/nvonnxparser_11.dll",
      "bytes": 0,
      "sha256": "0000000000000000000000000000000000000000000000000000000000000000"
    },
    {
      "path": "trt/nvinfer_builder_resource_ptx_11.dll",
      "bytes": 0,
      "sha256": "0000000000000000000000000000000000000000000000000000000000000000"
    },
    {
      "path": "trt/nvinfer_builder_resource_sm75_11.dll",
      "bytes": 0,
      "sha256": "0000000000000000000000000000000000000000000000000000000000000000"
    },
    {
      "path": "trt/nvinfer_builder_resource_sm80_11.dll",
      "bytes": 0,
      "sha256": "0000000000000000000000000000000000000000000000000000000000000000"
    },
    {
      "path": "trt/nvinfer_builder_resource_sm86_11.dll",
      "bytes": 0,
      "sha256": "0000000000000000000000000000000000000000000000000000000000000000"
    },
    {
      "path": "trt/nvinfer_builder_resource_sm89_11.dll",
      "bytes": 0,
      "sha256": "0000000000000000000000000000000000000000000000000000000000000000"
    },
    {
      "path": "trt/nvinfer_builder_resource_sm90_11.dll",
      "bytes": 0,
      "sha256": "0000000000000000000000000000000000000000000000000000000000000000"
    },
    {
      "path": "trt/nvinfer_builder_resource_sm100_11.dll",
      "bytes": 0,
      "sha256": "0000000000000000000000000000000000000000000000000000000000000000"
    },
    {
      "path": "trt/nvinfer_builder_resource_sm120_11.dll",
      "bytes": 0,
      "sha256": "0000000000000000000000000000000000000000000000000000000000000000"
    },
    {
      "path": "trt/cudart64_13.dll",
      "bytes": 0,
      "sha256": "0000000000000000000000000000000000000000000000000000000000000000"
    },
    {
      "path": "ort/onnxruntime.dll",
      "bytes": 0,
      "sha256": "0000000000000000000000000000000000000000000000000000000000000000"
    },
    {
      "path": "ort/onnxruntime_providers_shared.dll",
      "bytes": 0,
      "sha256": "0000000000000000000000000000000000000000000000000000000000000000"
    },
    {
      "path": "ort/DirectML.dll",
      "bytes": 0,
      "sha256": "0000000000000000000000000000000000000000000000000000000000000000"
    },
    {
      "path": "native_inspect.exe",
      "bytes": 0,
      "sha256": "0000000000000000000000000000000000000000000000000000000000000000"
    },
    {
      "path": "mikai_native_prep.exe",
      "bytes": 0,
      "sha256": "0000000000000000000000000000000000000000000000000000000000000000"
    },
    {
      "path": "mikai_native_verify.exe",
      "bytes": 0,
      "sha256": "0000000000000000000000000000000000000000000000000000000000000000"
    }
  ],
  "preparation": {
    "types": [
      "tensorrt",
      "directml"
    ],
    "source": {
      "coreSha": "0000000000000000000000000000000000000000",
      "sourceAbi": 0
    },
    "tools": {
      "inspect": "native_inspect.exe",
      "prep": "mikai_native_prep.exe",
      "verifier": "mikai_native_verify.exe"
    },
    "runtime": {
      "ort": "ort",
      "trt": "trt",
      "cuda": "trt"
    }
  }
}