{
  "schema": "mikai.native.bundle/1",
  "kind": "standard",
  "version": "0.41.0",
  "module": "libmpv-2.dll",
  "mpvApiVersion": 131077,
  "protocolVersion": 0,
  "engineSchemaVersion": 0,
  "deps": [],
  "files": [
    {
      "path": "libmpv-2.dll",
      "bytes": 0,
      "sha256": "0000000000000000000000000000000000000000000000000000000000000000"
    }
  ]
}